{
  "required" : true ,
  "$schema" : "http://json-schema.org/draft-03/schema" ,
  "type" : "object" ,
  "properties" : {
    "self" : {
      "type" : "string" ,
      "required" : false
    } ,
    "id" : {
      "type" : "string" ,
      "required" : false
    } ,
    "name" : {
      "type" : "string" ,
      "required" : false
    } ,
    "description" : {
      "type" : "string" ,
      "required" : false
    } ,
    "lead" : {
      "type" : "object" ,
      "required" : false ,
      "properties" : {
        "self" : {
          "type" : "string" ,
          "required" : false
        } ,
        "name" : {
          "type" : "string" ,
          "required" : false
        } ,
        "avatarUrls" : {
          "type" : "object" ,
          "required" : false ,
          "properties" : {
            "24x24" : {
              "type" : "string" ,
              "required" : false
            } ,
            "16x16" : {
              "type" : "string" ,
              "required" : false
            } ,
            "32x32" : {
              "type" : "string" ,
              "required" : false
            } ,
            "48x48" : {
              "type" : "string" ,
              "required" : false
            }
          }
        } ,
        "displayName" : {
          "type" : "string" ,
          "required" : false
        } ,
        "active" : {
          "type" : "boolean" ,
          "required" : false
        }
      }
    } ,
    "assigneeType" : {
      "type" : "string" ,
      "required" : false
    } ,
    "assignee" : {
      "type" : "object" ,
      "required" : false ,
      "properties" : {
        "self" : {
          "type" : "string" ,
          "required" : false
        } ,
        "name" : {
          "type" : "string" ,
          "required" : false
        } ,
        "avatarUrls" : {
          "type" : "object" ,
          "required" : false ,
          "properties" : {
            "24x24" : {
              "type" : "string" ,
              "required" : false
            } ,
            "16x16" : {
              "type" : "string" ,
              "required" : false
            } ,
            "32x32" : {
              "type" : "string" ,
              "required" : false
            } ,
            "48x48" : {
              "type" : "string" ,
              "required" : false
            }
          }
        } ,
        "displayName" : {
          "type" : "string" ,
          "required" : false
        } ,
        "active" : {
          "type" : "boolean" ,
          "required" : false
        }
      }
    } ,
    "realAssigneeType" : {
      "type" : "string" ,
      "required" : false
    } ,
    "realAssignee" : {
      "type" : "object" ,
      "required" : false ,
      "properties" : {
        "self" : {
          "type" : "string" ,
          "required" : false
        } ,
        "name" : {
          "type" : "string" ,
          "required" : false
        } ,
        "avatarUrls" : {
          "type" : "object" ,
          "required" : false ,
          "properties" : {
            "24x24" : {
              "type" : "string" ,
              "required" : false
            } ,
            "16x16" : {
              "type" : "string" ,
              "required" : false
            } ,
            "32x32" : {
              "type" : "string" ,
              "required" : false
            } ,
            "48x48" : {
              "type" : "string" ,
              "required" : false
            }
          }
        } ,
        "displayName" : {
          "type" : "string" ,
          "required" : false
        } ,
        "active" : {
          "type" : "boolean" ,
          "required" : false
        }
      }
    } ,
    "isAssigneeTypeValid" : {
      "type" : "boolean" ,
      "required" : false
    }
  }
}