{
  "self" : "http://www.example.com/jira/rest/api/2/component/10000" ,
  "id" : "10000" ,
  "name" : "Component 1" ,
  "description" : "This is a JIRA component" ,
  "lead" : {
    "self" : "http://www.example.com/jira/rest/api/2/user?username=fred" ,
    "name" : "fred" ,
    "avatarUrls" : {
      "24x24" : "http://www.example.com/jira/secure/useravatar?size=small&ownerId=fred" ,
      "16x16" : "http://www.example.com/jira/secure/useravatar?size=xsmall&ownerId=fred" ,
      "32x32" : "http://www.example.com/jira/secure/useravatar?size=medium&ownerId=fred" ,
      "48x48" : "http://www.example.com/jira/secure/useravatar?size=large&ownerId=fred"
    } ,
    "displayName" : "Fred F. User" ,
    "active" : false
  } ,
  "assigneeType" : "PROJECT_LEAD" ,
  "assignee" : {
    "self" : "http://www.example.com/jira/rest/api/2/user?username=fred" ,
    "name" : "fred" ,
    "avatarUrls" : {
      "24x24" : "http://www.example.com/jira/secure/useravatar?size=small&ownerId=fred" ,
      "16x16" : "http://www.example.com/jira/secure/useravatar?size=xsmall&ownerId=fred" ,
      "32x32" : "http://www.example.com/jira/secure/useravatar?size=medium&ownerId=fred" ,
      "48x48" : "http://www.example.com/jira/secure/useravatar?size=large&ownerId=fred"
    } ,
    "displayName" : "Fred F. User" ,
    "active" : false
  } ,
  "realAssigneeType" : "PROJECT_LEAD" ,
  "realAssignee" : {
    "self" : "http://www.example.com/jira/rest/api/2/user?username=fred" ,
    "name" : "fred" ,
    "avatarUrls" : {
      "24x24" : "http://www.example.com/jira/secure/useravatar?size=small&ownerId=fred" ,
      "16x16" : "http://www.example.com/jira/secure/useravatar?size=xsmall&ownerId=fred" ,
      "32x32" : "http://www.example.com/jira/secure/useravatar?size=medium&ownerId=fred" ,
      "48x48" : "http://www.example.com/jira/secure/useravatar?size=large&ownerId=fred"
    } ,
    "displayName" : "Fred F. User" ,
    "active" : false
  } ,
  "isAssigneeTypeValid" : false
}